{
  "version": "1.0.0",
  "method": {
    "inventory": [
      "Cyberpunk 2020 Weapons Listing v5 (unofficial inventory only)",
      "Cyberpunk 2020 Ammunition & Add-ons (unofficial inventory only)"
    ],
    "citationPolicy": "Public citations use official books only. Unofficial compilations are never presented as editorial sources; unresolved pages remain explicit."
  },
  "books": {
    "unverified": {
      "title": "Official origin",
      "kind": "unverified"
    },
    "corebook": {
      "title": "Cyberpunk 2020 Core Rulebook",
      "kind": "official"
    },
    "blackhands": {
      "title": "Blackhand's Street Weapons 2020",
      "kind": "official-reprint"
    },
    "chromebook-1": {
      "title": "Cyberpunk 2020 Chromebook 1",
      "kind": "official"
    },
    "chromebook-2": {
      "title": "Cyberpunk 2020 Chromebook 2",
      "kind": "official"
    },
    "chromebook-3": {
      "title": "Cyberpunk 2020 Chromebook 3",
      "kind": "official"
    },
    "chromebook-4": {
      "title": "Cyberpunk 2020 Chromebook 4",
      "kind": "official"
    },
    "maximum-metal": {
      "title": "Cyberpunk 2020 Maximum Metal",
      "kind": "official"
    },
    "home-of-the-brave": {
      "title": "Home of the Brave",
      "kind": "official"
    },
    "solo-of-fortune": {
      "title": "Solo of Fortune",
      "kind": "official"
    },
    "solo-of-fortune-2": {
      "title": "Solo of Fortune 2",
      "kind": "official"
    },
    "deep-space": {
      "title": "Deep Space",
      "kind": "official"
    },
    "rough-guide-uk": {
      "title": "Rough Guide to the UK",
      "kind": "official"
    },
    "rockerboy": {
      "title": "Rockerboy",
      "kind": "official"
    },
    "when-gravity-fails": {
      "title": "When Gravity Fails",
      "kind": "official"
    },
    "pacific-rim": {
      "title": "Pacific Rim Sourcebook",
      "kind": "official"
    },
    "shockwave": {
      "title": "Shockwave",
      "kind": "official"
    },
    "neo-tribes": {
      "title": "Neo Tribes",
      "kind": "official"
    },
    "listen-up": {
      "title": "Listen Up, You Primitive Screwheads!",
      "kind": "official"
    },
    "edgerunners": {
      "title": "Edgerunners Inc.",
      "kind": "official"
    },
    "interface-1-1": {
      "title": "Interface Magazine, Vol. 1, No. 1",
      "kind": "official"
    },
    "interface-1-3": {
      "title": "Interface Magazine, Vol. 1, No. 3",
      "kind": "official"
    },
    "interface-1-4": {
      "title": "Interface Magazine, Vol. 1, No. 4",
      "kind": "official"
    },
    "interface-2-1": {
      "title": "Interface Magazine, Vol. 2, No. 1",
      "kind": "official"
    },
    "interface-2-2": {
      "title": "Interface Magazine, Vol. 2, No. 2",
      "kind": "official"
    },
    "corporation-report-2": {
      "title": "Corporation Report 2020, Vol. 2",
      "kind": "official"
    },
    "corporation-report-3": {
      "title": "Corporation Report 2020, Vol. 3",
      "kind": "official"
    },
    "source-code-sf": {
      "title": "Official source code SF",
      "kind": "unverified"
    },
    "source-code-sa": {
      "title": "Official source code SA",
      "kind": "unverified"
    },
    "source-code-ws": {
      "title": "Official source code WS",
      "kind": "unverified"
    },
    "source-code-p1": {
      "title": "Official source code P1",
      "kind": "unverified"
    },
    "source-code-p2": {
      "title": "Official source code P2",
      "kind": "unverified"
    },
    "source-code-p3": {
      "title": "Official source code P3",
      "kind": "unverified"
    },
    "source-code-ttb": {
      "title": "Official source code TTB",
      "kind": "unverified"
    },
    "source-code-rpi": {
      "title": "Official source code RPI",
      "kind": "unverified"
    }
  },
  "catalogs": {
    "weapons": {
      "default": {
        "sourceId": "unverified",
        "verification": "unverified"
      },
      "items": {
        "weapon_astra_style_6": {
          "sourceId": "blackhands",
          "verification": "page",
          "pages": "10",
          "note": "Official reprint page verified against the supplied PDF."
        },
        "weapon_budgetarms_c_13": {
          "sourceId": "blackhands",
          "verification": "page",
          "pages": "10",
          "note": "Official reprint page verified against the supplied PDF."
        },
        "weapon_dai_lung_cybermag_15": {
          "sourceId": "blackhands",
          "verification": "page",
          "pages": "10",
          "note": "Official reprint page verified against the supplied PDF."
        },
        "weapon_federated_arms_impact": {
          "sourceId": "blackhands",
          "verification": "page",
          "pages": "10",
          "note": "Official reprint page verified against the supplied PDF."
        },
        "weapon_federated_arms_x_22": {
          "sourceId": "blackhands",
          "verification": "page",
          "pages": "10",
          "note": "Official reprint page verified against the supplied PDF."
        },
        "weapon_federated_arms_x_38": {
          "sourceId": "blackhands",
          "verification": "page",
          "pages": "10",
          "note": "Official reprint page verified against the supplied PDF."
        },
        "weapon_towa_manufacturing_type_12_police_pistol": {
          "sourceId": "blackhands",
          "verification": "page",
          "pages": "10",
          "note": "Official reprint page verified against the supplied PDF."
        },
        "weapon_arasaka_wsa_autopistol": {
          "sourceId": "blackhands",
          "verification": "page",
          "pages": "10",
          "note": "Official reprint page verified against the supplied PDF."
        },
        "weapon_budgetarms_c_41": {
          "sourceId": "blackhands",
          "verification": "page",
          "pages": "11",
          "note": "Official reprint page verified against the supplied PDF."
        },
        "weapon_budgetarms_laser_niner": {
          "sourceId": "blackhands",
          "verification": "page",
          "pages": "11",
          "note": "Official reprint page verified against the supplied PDF."
        },
        "weapon_beretta_m97p": {
          "sourceId": "blackhands",
          "verification": "page",
          "pages": "11",
          "note": "Official reprint page verified against the supplied PDF."
        },
        "weapon_ccmmc_goaxing_xiuxi_cm_3": {
          "sourceId": "blackhands",
          "verification": "page",
          "pages": "11",
          "note": "Official reprint page verified against the supplied PDF."
        },
        "weapon_colt_alpha_omega_competition_pistol_45_acp": {
          "sourceId": "blackhands",
          "verification": "page",
          "pages": "11",
          "note": "Official reprint page verified against the supplied PDF."
        },
        "weapon_colt_alpha_omega_competition_pistol_10mm": {
          "sourceId": "blackhands",
          "verification": "page",
          "pages": "11",
          "note": "Official reprint page verified against the supplied PDF."
        },
        "weapon_colt_enforcement_10_sidearm_basic": {
          "sourceId": "blackhands",
          "verification": "page",
          "pages": "11",
          "note": "Official reprint page verified against the supplied PDF."
        },
        "weapon_colt_enforcement_10_sidearm_camouflaged": {
          "sourceId": "blackhands",
          "verification": "page",
          "pages": "11",
          "note": "Official reprint page verified against the supplied PDF."
        },
        "weapon_dai_lung_streetmaster": {
          "sourceId": "blackhands",
          "verification": "page",
          "pages": "11",
          "note": "Official reprint page verified against the supplied PDF."
        },
        "weapon_fn_browning_3_spot_machine_pistol": {
          "sourceId": "blackhands",
          "verification": "page",
          "pages": "11",
          "note": "Official reprint page verified against the supplied PDF."
        },
        "weapon_federated_arms_x_9mm": {
          "sourceId": "blackhands",
          "verification": "page",
          "pages": "11",
          "note": "Official reprint page verified against the supplied PDF."
        },
        "weapon_fashion_gun_9": {
          "sourceId": "blackhands",
          "verification": "page",
          "pages": "11",
          "note": "Official reprint page verified against the supplied PDF."
        },
        "weapon_goncz_taurus_pistol": {
          "sourceId": "blackhands",
          "verification": "page",
          "pages": "12",
          "note": "Official reprint page verified against the supplied PDF."
        },
        "weapon_goncz_taurus_pistol_selective_fire": {
          "sourceId": "blackhands",
          "verification": "page",
          "pages": "12",
          "note": "Official reprint page verified against the supplied PDF."
        },
        "weapon_glock_thirty_machine_pistol": {
          "sourceId": "blackhands",
          "verification": "page",
          "pages": "12",
          "note": "Official reprint page verified against the supplied PDF."
        },
        "weapon_hammer_m_11_bolt_pistol": {
          "sourceId": "blackhands",
          "verification": "page",
          "pages": "12",
          "note": "Official reprint page verified against the supplied PDF."
        },
        "weapon_imi_gamad": {
          "sourceId": "blackhands",
          "verification": "page",
          "pages": "12",
          "note": "Official reprint page verified against the supplied PDF."
        },
        "weapon_kang_tao_type_97": {
          "sourceId": "blackhands",
          "verification": "page",
          "pages": "12",
          "note": "Official reprint page verified against the supplied PDF."
        },
        "weapon_leroi_maxi_10": {
          "sourceId": "blackhands",